{
  "id": "fixture_intent_test_001",
  "state": "ready_for_review",
  "source": "coindesk",
  "title": "Fixturing Intent Generation",
  "summary": "This is a test candidate to verify the generate-intents.mjs script logic.",
  "category": "Macro_Liquidity",
  "score": 82,
  "confidence": 0.88,
  "created_at": "2026-04-20T12:00:00Z",
  "decision": {
    "gate_applied": "ready_for_review",
    "timestamp": "2026-04-20T12:05:00Z",
    "reason": "Meets all ready_for_review criteria in tests",
    "evaluator": "test_suite"
  },
  "state_transitions": [
    {
      "from": "candidate",
      "to": "ready_for_review",
      "timestamp": "2026-04-20T12:05:00Z",
      "reason": "Automated test promotion"
    }
  ]
}
