{
  "id": "2026-04-10_low_confidence_example",
  "state": "no_candidate",
  "source": "messari",
  "title": "Unverified DeFi Protocol Exploit Rumor",
  "summary": "Unconfirmed social media reports of exploit in unnamed DeFi protocol. No official disclosure. Source tier_2, anonymous origin, no corroboration from tier_1 outlets.",
  "category": "Other",
  "score": 35,
  "confidence": 0.42,
  "created_at": "2026-04-10T08:00:00Z",
  "decision": {
    "gate_applied": "no_candidate",
    "timestamp": "2026-04-10T08:15:00Z",
    "reason": "Rejected by no_candidate gate: confidence=0.42 (<0.50 min), score=35 (<40 min). Unverified rumor with no primary source confirmation. Does not meet minimum viability threshold.",
    "evaluator": "human_editorial"
  },
  "state_transitions": [
    {
      "from": "no_candidate",
      "to": "no_candidate",
      "timestamp": "2026-04-10T08:15:00Z",
      "reason": "Initial evaluation — below both score and confidence thresholds."
    }
  ],
  "metadata": {
    "detected_at": "2026-04-10T08:00:00Z",
    "parent_signal_id": null,
    "related_signals": [],
    "notes": "Fixture: no_candidate outcome. score<40 AND confidence<0.50 → rejected."
  }
}
