{
  "id": "2026-04-10_moderate_confidence_example",
  "state": "candidate",
  "source": "coindesk",
  "title": "ETF Inflows Show Sustained Institutional Demand for Bitcoin",
  "summary": "On-chain and ETF flow data from CoinDesk Research indicate three consecutive weeks of net institutional inflows into BTC spot ETFs. Signal is directional but not yet at P1 threshold.",
  "category": "Btc_Whale_Activity",
  "score": 58,
  "confidence": 0.62,
  "created_at": "2026-04-10T09:00:00Z",
  "decision": {
    "gate_applied": "candidate",
    "timestamp": "2026-04-10T09:30:00Z",
    "reason": "Passed candidate gate: confidence=0.62 (>=0.50), score=58 (>=40), source=coindesk (approved). Signal viable. Escalating to QuantLab review queue for human judgment.",
    "evaluator": "human_editorial"
  },
  "state_transitions": [
    {
      "from": "no_candidate",
      "to": "candidate",
      "timestamp": "2026-04-10T09:30:00Z",
      "reason": "Candidate gate accepted: meets minimum viability thresholds. Confidence below ready_for_review threshold (0.75)."
    }
  ],
  "metadata": {
    "detected_at": "2026-04-10T09:00:00Z",
    "parent_signal_id": null,
    "related_signals": [],
    "links": [
      "https://coindesk.com/markets/2026/04/10/btc-etf-inflows"
    ],
    "notes": "Fixture: candidate outcome. score>=40 AND confidence>=0.50 AND confidence<0.75 → candidate."
  }
}
